{"contract":"lmdj.soundset.v1","license":{"attribution":"Alice","copyright":"Copyright 2026 Alice","rights_holder":"Alice","spdx_id":"CC-BY-4.0"},"name":"Kit A","publisher":"LMDJ","set_id":"10000000-0000-4000-8000-000000000001","slots":[{"artifact":{"byte_length":44,"media_type":"audio/wav","sha256":"aaaaaaaaaaaaaaaaaaaaaaaaaaaaaaaaaaaaaaaaaaaaaaaaaaaaaaaaaaaaaaaa"},"name":"Kick","role":"kick","slot":0},{"slot":1},{"slot":2},{"slot":3},{"slot":4},{"slot":5},{"slot":6},{"slot":7},{"slot":8},{"slot":9},{"slot":10},{"slot":11},{"slot":12},{"slot":13},{"slot":14},{"slot":15}],"version":"1.0.0"}